<meiQiReferrer xmlns:xsi="http://www.w3.org/2001/XMLSchema-instance" xsi:noNamespaceSchemaLocation="orderList.xsd">
	<sections>
		<sectionName>MQTableBaseSection</sectionName>
		<sectionItems>
			<viewName>MQTitleTableViewCell</viewName>
			<data>
				<leftFirstValue>收货人</leftFirstValue>
				<leftSecondValue>${OrderItem.consignee.name}</leftSecondValue>
				<leftThirdValue>${OrderItem.consignee.phone((\d{3})(\d{4})(\d{4}),$1****$3)}
				</leftThirdValue>
				<rightRedValue>等待发货</rightRedValue>
			</data>
		</sectionItems>
		<sectionItems>
			<viewName>MQSingleGoodTableCell</viewName>
			<data>
				<lblTitle>${OrderItem.carts[0].goods.name}</lblTitle>
				<lblGoodsAmount>￥${OrderItem.carts[0].goods.price}</lblGoodsAmount>
				<lblAmount>x${OrderItem.carts[0].goodsAmount}</lblAmount>
				<imgvURL>${OrderItem.carts[0].goods.cover}</imgvURL>
				<lblStandardName>${OrderItem.carts[0].goods.standardName}
				</lblStandardName>
			</data>
		</sectionItems>
		<sectionItems>
			<viewName>MQButtonActionTableViewCell</viewName>
			<data>
				<leftFirstValue>下单时间:</leftFirstValue>
				<lelftSecondValue>${OrderItem.addDate}</lelftSecondValue>
				<leftThirdValue>共${OrderItem.goodsSize}件,</leftThirdValue>
				<leftFourthValue>实付款:</leftFourthValue>
				<leftFifthValue>￥${OrderItem.amount}</leftFifthValue>
			</data>
		</sectionItems>
		<actions>
			<actionName>showOrderDetail</actionName>
			<sender>self</sender>
			<title></title>
			<actionValue>${OrderItem.orderId}</actionValue>
		</actions>
		<actions/>
	</sections>
	<sections/>
</meiQiReferrer>