<meiQiReferrer xmlns:xsi="http://www.w3.org/2001/XMLSchema-instance" xsi:noNamespaceSchemaLocation="orderList.xsd">
	<sections>
		<sectionName>MQTableBaseSection</sectionName>
		<sectionItems>
			<viewName>MQTitleTableViewCell</viewName>
			<data>
				<leftFirstValue>收货人</leftFirstValue>
				<leftSecondValue>${OrderItem.consignee.name}</leftSecondValue>
				<leftThirdValue>${OrderItem.consignee.phone((\d{3})(\d{4})(\d{4}),$1****$3)}</leftThirdValue>
				<rightRedValue>等待付款</rightRedValue>
			</data>
		</sectionItems>
		<sectionItems>
			<viewName>MQSingleGoodTableCell</viewName>
			<data>
				<lblTitle>${OrderItem.carts[0].goods.name}</lblTitle>
				<lblGoodsAmount>￥${OrderItem.carts[0].goods.price}</lblGoodsAmount>
				<lblAmount>x${OrderItem.carts[0].goodsAmount}</lblAmount>
				<imgvURL>${OrderItem.carts[0].goods.cover}</imgvURL>
				<lblStandardName>${OrderItem.carts[0].goods.standardName}</lblStandardName>
			</data>
		</sectionItems>
		<sectionItems>
			<viewName>MQButtonActionTableViewCell</viewName>
			<data>
				<leftFirstValue>应付款:</leftFirstValue>
				<lelftSecondValue>￥${OrderItem.amount}</lelftSecondValue>
			</data>
			<actions>
				<actionName>payCommand</actionName>
				<sender>btnRed</sender>
				<title>去支付</title>
				<actionValue>${OrderItem.orderId}</actionValue>
			</actions>
			<actions />
		</sectionItems>
		<actions>
			<actionName>showOrderDetail</actionName>
			<sender>self</sender>
			<title></title>
			<actionValue>${OrderItem.orderId}</actionValue>
		</actions>
		<actions/>
	</sections>
	<sections/>
</meiQiReferrer>